{"updated_utc": "2026-10-01T13:13:15Z", "node": "9308-zebra-mainnet", "rpc_ok": true, "rpc_error": null, "chain": "main", "blocks": 3502622, "headers": 3502622, "estimated_height": 3502623, "best_block_hash": "0000000000226a0a601d7360b9925e746f596d854e175ef3ab4a709edb65f858", "difficulty": 229710546.45858142, "size_on_disk_gb": 280.41, "verification_progress_pct": 100.0, "chain_supply_zec": 16962479.8530448, "blocks_behind_estimated": 1, "zebra_version": "/Zebra:6.3.0/", "protocol_version": 170160, "connections": 9, "disk": {"df": ["/dev/loop7", "590G", "292G", "270G", "52%", "/var/lib/zcash"]}}